    [32m[I 2021-11-22 16:58:34,683][0m Trial 7 finished with value: 819804093.191586 and parameters: {'learning_rate': 0.04089996575161834, 'reg_lambda': 8.596335607070313e-05, 'reg_alpha': 0.02043920450683123, 'subsample': 0.9184407885806762, 'colsample_bytree': 0.20385362758786968, 'max_depth': 9, 'early_stopping_rounds': 485, 'n_estimators': 20000, 'tree_method': 'exact', 'booster': 'gblinear'}. Best is trial 7 with value: 819804093.191586.[0m
    2021-11-22 16:58:34,804 INFO Training Started!
    2021-11-22 16:59:17,739 INFO Training Ended!
    2021-11-22 16:59:18,499 INFO mean_absolute_error: 16149.496602097603
    2021-11-22 16:59:18,500 INFO mean_squared_error: 842794160.6512825
    2021-11-22 16:59:18,500 INFO r2_score: 0.8901227747182928
    [32m[I 2021-11-22 16:59:18,532][0m Trial 8 finished with value: 842794160.6512825 and parameters: {'learning_rate': 0.030222339821538807, 'reg_lambda': 0.09895705776538985, 'reg_alpha': 2.2504091517410305e-06, 'subsample': 0.5584749705539753, 'colsample_bytree': 0.15912009415082107, 'max_depth': 9, 'early_stopping_rounds': 500, 'n_estimators': 20000, 'tree_method': 'exact', 'booster': 'gbtree', 'gamma': 9.917098787836175e-07, 'grow_policy': 'lossguide'}. Best is trial 7 with value: 819804093.191586.[0m
    2021-11-22 16:59:18,717 INFO Training Started!


    [16:59:18] WARNING: /Users/runner/miniforge3/conda-bld/xgboost-split_1634712680264/work/src/learner.cc:576: 
    Parameters: { "colsample_bytree", "max_depth", "subsample", "tree_method" } might not be used.
    
      This could be a false alarm, with some parameters getting used by language bindings but
      then being mistakenly passed down to XGBoost core, or some parameter actually being used
      but getting flagged wrongly here. Please open an issue if you find any such cases.
    
    


    2021-11-22 16:59:23,129 INFO Training Ended!
    2021-11-22 16:59:23,177 INFO mean_absolute_error: 18419.340887200342
    2021-11-22 16:59:23,178 INFO mean_squared_error: 817311608.0615362
    2021-11-22 16:59:23,178 INFO r2_score: 0.8934450001232396
    [32m[I 2021-11-22 16:59:23,208][0m Trial 9 finished with value: 817311608.0615362 and parameters: {'learning_rate': 0.22322780828302763, 'reg_lambda': 1.6754489349191887e-05, 'reg_alpha': 2.1992031654524757e-06, 'subsample': 0.5257239751043923, 'colsample_bytree': 0.1836836077039992, 'max_depth': 6, 'early_stopping_rounds': 442, 'n_estimators': 15000, 'tree_method': 'approx', 'booster': 'gblinear'}. Best is trial 9 with value: 817311608.0615362.[0m
    2021-11-22 16:59:23,321 INFO Training Started!


    [16:59:23] WARNING: /Users/runner/miniforge3/conda-bld/xgboost-split_1634712680264/work/src/learner.cc:576: 
    Parameters: { "colsample_bytree", "max_depth", "subsample", "tree_method" } might not be used.
    
      This could be a false alarm, with some parameters getting used by language bindings but
      then being mistakenly passed down to XGBoost core, or some parameter actually being used
      but getting flagged wrongly here. Please open an issue if you find any such cases.
    
    


    2021-11-22 16:59:28,052 INFO Training Ended!
    2021-11-22 16:59:28,104 INFO mean_absolute_error: 56409.48624785959
    2021-11-22 16:59:28,105 INFO mean_squared_error: 6504554246.374722
    2021-11-22 16:59:28,105 INFO r2_score: 0.15198466523106557
    [32m[I 2021-11-22 16:59:28,137][0m Trial 10 finished with value: 6504554246.374722 and parameters: {'learning_rate': 0.1340147043391367, 'reg_lambda': 63.39872490630416, 'reg_alpha': 6.373289028896017e-05, 'subsample': 0.4471511816218636, 'colsample_bytree': 0.20334039219317368, 'max_depth': 4, 'early_stopping_rounds': 101, 'n_estimators': 15000, 'tree_method': 'hist', 'booster': 'gblinear'}. Best is trial 9 with value: 817311608.0615362.[0m
    2021-11-22 16:59:28,237 INFO Training Started!


    [16:59:28] WARNING: /Users/runner/miniforge3/conda-bld/xgboost-split_1634712680264/work/src/learner.cc:576: 
    Parameters: { "colsample_bytree", "max_depth", "subsample", "tree_method" } might not be used.
    
      This could be a false alarm, with some parameters getting used by language bindings but
      then being mistakenly passed down to XGBoost core, or some parameter actually being used
      but getting flagged wrongly here. Please open an issue if you find any such cases.
    
    


    2021-11-22 16:59:35,476 INFO Training Ended!
    2021-11-22 16:59:35,527 INFO mean_absolute_error: 18619.747498394692
    2021-11-22 16:59:35,528 INFO mean_squared_error: 1060765653.880221
    2021-11-22 16:59:35,528 INFO r2_score: 0.8617052749482441
    [32m[I 2021-11-22 16:59:35,552][0m Trial 11 finished with value: 1060765653.880221 and parameters: {'learning_rate': 0.018948988994948266, 'reg_lambda': 0.11940360049263372, 'reg_alpha': 0.3478769379762252, 'subsample': 0.19267541567301605, 'colsample_bytree': 0.46957499489616195, 'max_depth': 3, 'early_stopping_rounds': 390, 'n_estimators': 20000, 'tree_method': 'exact', 'booster': 'gblinear'}. Best is trial 9 with value: 817311608.0615362.[0m
    2021-11-22 16:59:35,686 INFO Training Started!
    2021-11-22 17:00:28,688 INFO Training Ended!
    2021-11-22 17:00:28,888 INFO mean_absolute_error: 16017.475412029109
    2021-11-22 17:00:28,888 INFO mean_squared_error: 731863525.6978335
    2021-11-22 17:00:28,889 INFO r2_score: 0.9045850846588409
    [32m[I 2021-11-22 17:00:28,915][0m Trial 12 finished with value: 731863525.6978335 and parameters: {'learning_rate': 0.07808709699682324, 'reg_lambda': 9.871089998565025e-08, 'reg_alpha': 1.0673222786209778e-08, 'subsample': 0.7165371749773521, 'colsample_bytree': 0.7641468442580719, 'max_depth': 7, 'early_stopping_rounds': 376, 'n_estimators': 15000, 'tree_method': 'approx', 'booster': 'gbtree', 'gamma': 0.8079088948323129, 'grow_policy': 'lossguide'}. Best is trial 12 with value: 731863525.6978335.[0m
    2021-11-22 17:00:29,106 INFO Training Started!
    2021-11-22 17:01:16,207 INFO Training Ended!
    2021-11-22 17:01:16,377 INFO mean_absolute_error: 16352.778454088186
    2021-11-22 17:01:16,378 INFO mean_squared_error: 744122288.9684557
    2021-11-22 17:01:16,379 INFO r2_score: 0.9029868784105675
    [32m[I 2021-11-22 17:01:16,409][0m Trial 13 finished with value: 744122288.9684557 and parameters: {'learning_rate': 0.08318544049038572, 'reg_lambda': 4.654274233615053e-08, 'reg_alpha': 2.184767986189026e-08, 'subsample': 0.6746291410083555, 'colsample_bytree': 0.7990169757948151, 'max_depth': 7, 'early_stopping_rounds': 381, 'n_estimators': 15000, 'tree_method': 'approx', 'booster': 'gbtree', 'gamma': 0.4585867037796719, 'grow_policy': 'lossguide'}. Best is trial 12 with value: 731863525.6978335.[0m
    2021-11-22 17:01:16,594 INFO Training Started!
    2021-11-22 17:02:07,158 INFO Training Ended!
    2021-11-22 17:02:07,335 INFO mean_absolute_error: 16126.497953232021
    2021-11-22 17:02:07,336 INFO mean_squared_error: 780217945.1506925
    2021-11-22 17:02:07,337 INFO r2_score: 0.8982809956088145
    [32m[I 2021-11-22 17:02:07,365][0m Trial 14 finished with value: 780217945.1506925 and parameters: {'learning_rate': 0.07549860943857781, 'reg_lambda': 1.7749082269700017e-08, 'reg_alpha': 1.941329606118197e-08, 'subsample': 0.736007047743309, 'colsample_bytree': 0.8737589345624964, 'max_depth': 7, 'early_stopping_rounds': 357, 'n_estimators': 15000, 'tree_method': 'approx', 'booster': 'gbtree', 'gamma': 0.8158952450888562, 'grow_policy': 'lossguide'}. Best is trial 12 with value: 731863525.6978335.[0m
    2021-11-22 17:02:07,553 INFO Training Started!
    2021-11-22 17:02:47,669 INFO Training Ended!
    2021-11-22 17:02:48,209 INFO mean_absolute_error: 15801.584706763699
    2021-11-22 17:02:48,210 INFO mean_squared_error: 766536423.2441648
    2021-11-22 17:02:48,211 INFO r2_score: 0.9000646905309038
    [32m[I 2021-11-22 17:02:48,247][0m Trial 15 finished with value: 766536423.2441648 and parameters: {'learning_rate': 0.07398928435966287, 'reg_lambda': 1.1940556339241501e-08, 'reg_alpha': 1.760152827513985e-08, 'subsample': 0.7195078189746692, 'colsample_bytree': 0.6899120607572461, 'max_depth': 7, 'early_stopping_rounds': 335, 'n_estimators': 15000, 'tree_method': 'approx', 'booster': 'gbtree', 'gamma': 0.008291443066176078, 'grow_policy': 'lossguide'}. Best is trial 12 with value: 731863525.6978335.[0m
    2021-11-22 17:02:48,427 INFO Training Started!
    2021-11-22 17:03:35,781 INFO Training Ended!
    2021-11-22 17:03:36,139 INFO mean_absolute_error: 15482.647688356165
    2021-11-22 17:03:36,140 INFO mean_squared_error: 686933953.1421537
    2021-11-22 17:03:36,140 INFO r2_score: 0.9104426676797013
    [32m[I 2021-11-22 17:03:36,166][0m Trial 16 finished with value: 686933953.1421537 and parameters: {'learning_rate': 0.08235476908327058, 'reg_lambda': 6.647799361804065e-07, 'reg_alpha': 1.0067601266720434e-08, 'subsample': 0.7228884546525054, 'colsample_bytree': 0.9947016819536298, 'max_depth': 7, 'early_stopping_rounds': 409, 'n_estimators': 15000, 'tree_method': 'approx', 'booster': 'gbtree', 'gamma': 0.0038226799902060316, 'grow_policy': 'lossguide'}. Best is trial 16 with value: 686933953.1421537.[0m
    2021-11-22 17:03:36,332 INFO Training Started!
    2021-11-22 17:03:55,399 INFO Training Ended!
    2021-11-22 17:03:55,565 INFO mean_absolute_error: 16349.99369916524
    2021-11-22 17:03:55,566 INFO mean_squared_error: 807699951.7007654
    2021-11-22 17:03:55,567 INFO r2_score: 0.8946980962890538
    [32m[I 2021-11-22 17:03:55,600][0m Trial 17 finished with value: 807699951.7007654 and parameters: {'learning_rate': 0.055596616114553216, 'reg_lambda': 1.3893364258209366e-06, 'reg_alpha': 67.41099834562895, 'subsample': 0.8192815751548503, 'colsample_bytree': 0.9860680008198711, 'max_depth': 8, 'early_stopping_rounds': 427, 'n_estimators': 15000, 'tree_method': 'approx', 'booster': 'gbtree', 'gamma': 0.001304182841715915, 'grow_policy': 'lossguide'}. Best is trial 16 with value: 686933953.1421537.[0m
    2021-11-22 17:03:55,770 INFO Training Started!
    2021-11-22 17:04:11,003 INFO Training Ended!
    2021-11-22 17:04:11,158 INFO mean_absolute_error: 15908.28640036387
    2021-11-22 17:04:11,159 INFO mean_squared_error: 778115201.6020439
    2021-11-22 17:04:11,160 INFO r2_score: 0.8985551356508219
    [32m[I 2021-11-22 17:04:11,188][0m Trial 18 finished with value: 778115201.6020439 and parameters: {'learning_rate': 0.09711661764783566, 'reg_lambda': 7.823454743474081e-07, 'reg_alpha': 4.5072692770014974e-07, 'subsample': 0.6263107892204567, 'colsample_bytree': 0.9527217430143557, 'max_depth': 5, 'early_stopping_rounds': 318, 'n_estimators': 7000, 'tree_method': 'approx', 'booster': 'gbtree', 'gamma': 1.117709416173302e-08, 'grow_policy': 'lossguide'}. Best is trial 16 with value: 686933953.1421537.[0m
    2021-11-22 17:04:11,326 INFO Training Started!
    2021-11-22 17:04:40,256 INFO Training Ended!
    2021-11-22 17:04:40,573 INFO mean_absolute_error: 15689.446797410103
    2021-11-22 17:04:40,574 INFO mean_squared_error: 716682978.005267
    2021-11-22 17:04:40,574 INFO r2_score: 0.9065642113977197
