Metadata-Version: 2.1
Name: tabular-ml-toolkit
Version: 0.0.18
Summary: A helper library to jumpstart your machine learning project based on tabular or structured data.
Home-page: https://github.com/psmathur/tabular_ml_toolkit/tree/master/
Author: Pankaj Mathur
Author-email: psmathur.public@gmail.com
License: Apache Software License 2.0
Keywords: machine learning,tabular data,scikit-learn,XGBoost
Platform: UNKNOWN
Classifier: Development Status :: 3 - Alpha
Classifier: Intended Audience :: Developers
Classifier: Natural Language :: English
Classifier: Programming Language :: Python :: 3.6
Classifier: Programming Language :: Python :: 3.7
Classifier: Programming Language :: Python :: 3.8
Classifier: License :: OSI Approved :: Apache Software License
Requires-Python: >=3.6
Description-Content-Type: text/markdown
Provides-Extra: dev
License-File: LICENSE

# Getting Started Tutorial with TMLT (Tabular ML Toolkit)
> A tutorial on getting started with TMLT (Tabular ML Toolkit)


```
%load_ext autoreload
%autoreload 2
```

## Install

`pip install -U tabular_ml_toolkit`

## How to Best Use tabular_ml_toolkit

Start with your favorite model and then just simply create MLPipeline with one API.

*For example, Here we are using RandomForestRegressor from Scikit-Learn, on  [Melbourne Home Sale price data](https://www.kaggle.com/estrotococo/home-data-for-ml-course)*


*No need to install scikit-learn as it comes preinstall with Tabular_ML_Toolkit*

```
from tabular_ml_toolkit.tmlt import *
from sklearn.ensemble import RandomForestRegressor
from sklearn.metrics import mean_absolute_error
import numpy as np

# for displaying diagram of pipelines 
from sklearn import set_config
set_config(display="diagram")

# Just to compare fit times
import time
```

```
# Dataset file names and Paths
DIRECTORY_PATH = "input/home_data/"
TRAIN_FILE = "train.csv"
TEST_FILE = "test.csv"
SAMPLE_SUB_FILE = "sample_submission.csv"
OUTPUT_PATH = "output/"
```

```
from xgboost import XGBRegressor
xgb_params = {
    'use_label_encoder':False,
    'eval_metric':'rmse',
    'random_state':42,
    # for GPU
#     'tree_method': 'gpu_hist',
#     'predictor': 'gpu_predictor',
}
# create xgb ml model
xgb_model = XGBRegressor(**xgb_params)
```

##### Just point in the direction of your data, let tmlt know what are idx and target columns in your tabular data and what kind of problem type you are trying to resolve

```
# tmlt
tmlt = TMLT().prepare_data_for_training(
    train_file_path= DIRECTORY_PATH+TRAIN_FILE,
    test_file_path= DIRECTORY_PATH+TEST_FILE,
    idx_col="Id", target="SalePrice",
    model=xgb_model,
    random_state=42,
    problem_type="regression")
```

    2021-11-22 16:57:13,379 INFO 12 cores found, model and data parallel processing should worked!
    2021-11-22 16:57:13,432 INFO DataFrame Memory usage decreased to 0.58 Mb (35.5% reduction)
    2021-11-22 16:57:13,479 INFO DataFrame Memory usage decreased to 0.58 Mb (34.8% reduction)
    2021-11-22 16:57:13,512 INFO Both Numerical & Categorical columns found, Preprocessing will done accordingly!


```
# check sklearn pipeline
tmlt.spl
```




<style>#sk-9fa8e572-fc23-49ec-a461-bed4406d18f9 {color: black;background-color: white;}#sk-9fa8e572-fc23-49ec-a461-bed4406d18f9 pre{padding: 0;}#sk-9fa8e572-fc23-49ec-a461-bed4406d18f9 div.sk-toggleable {background-color: white;}#sk-9fa8e572-fc23-49ec-a461-bed4406d18f9 label.sk-toggleable__label {cursor: pointer;display: block;width: 100%;margin-bottom: 0;padding: 0.3em;box-sizing: border-box;text-align: center;}#sk-9fa8e572-fc23-49ec-a461-bed4406d18f9 div.sk-toggleable__content {max-height: 0;max-width: 0;overflow: hidden;text-align: left;background-color: #f0f8ff;}#sk-9fa8e572-fc23-49ec-a461-bed4406d18f9 div.sk-toggleable__content pre {margin: 0.2em;color: black;border-radius: 0.25em;background-color: #f0f8ff;}#sk-9fa8e572-fc23-49ec-a461-bed4406d18f9 input.sk-toggleable__control:checked~div.sk-toggleable__content {max-height: 200px;max-width: 100%;overflow: auto;}#sk-9fa8e572-fc23-49ec-a461-bed4406d18f9 div.sk-estimator input.sk-toggleable__control:checked~label.sk-toggleable__label {background-color: #d4ebff;}#sk-9fa8e572-fc23-49ec-a461-bed4406d18f9 div.sk-label input.sk-toggleable__control:checked~label.sk-toggleable__label {background-color: #d4ebff;}#sk-9fa8e572-fc23-49ec-a461-bed4406d18f9 input.sk-hidden--visually {border: 0;clip: rect(1px 1px 1px 1px);clip: rect(1px, 1px, 1px, 1px);height: 1px;margin: -1px;overflow: hidden;padding: 0;position: absolute;width: 1px;}#sk-9fa8e572-fc23-49ec-a461-bed4406d18f9 div.sk-estimator {font-family: monospace;background-color: #f0f8ff;border: 1px dotted black;border-radius: 0.25em;box-sizing: border-box;margin-bottom: 0.5em;}#sk-9fa8e572-fc23-49ec-a461-bed4406d18f9 div.sk-estimator:hover {background-color: #d4ebff;}#sk-9fa8e572-fc23-49ec-a461-bed4406d18f9 div.sk-parallel-item::after {content: "";width: 100%;border-bottom: 1px solid gray;flex-grow: 1;}#sk-9fa8e572-fc23-49ec-a461-bed4406d18f9 div.sk-label:hover label.sk-toggleable__label {background-color: #d4ebff;}#sk-9fa8e572-fc23-49ec-a461-bed4406d18f9 div.sk-serial::before {content: "";position: absolute;border-left: 1px solid gray;box-sizing: border-box;top: 2em;bottom: 0;left: 50%;}#sk-9fa8e572-fc23-49ec-a461-bed4406d18f9 div.sk-serial {display: flex;flex-direction: column;align-items: center;background-color: white;padding-right: 0.2em;padding-left: 0.2em;}#sk-9fa8e572-fc23-49ec-a461-bed4406d18f9 div.sk-item {z-index: 1;}#sk-9fa8e572-fc23-49ec-a461-bed4406d18f9 div.sk-parallel {display: flex;align-items: stretch;justify-content: center;background-color: white;}#sk-9fa8e572-fc23-49ec-a461-bed4406d18f9 div.sk-parallel::before {content: "";position: absolute;border-left: 1px solid gray;box-sizing: border-box;top: 2em;bottom: 0;left: 50%;}#sk-9fa8e572-fc23-49ec-a461-bed4406d18f9 div.sk-parallel-item {display: flex;flex-direction: column;position: relative;background-color: white;}#sk-9fa8e572-fc23-49ec-a461-bed4406d18f9 div.sk-parallel-item:first-child::after {align-self: flex-end;width: 50%;}#sk-9fa8e572-fc23-49ec-a461-bed4406d18f9 div.sk-parallel-item:last-child::after {align-self: flex-start;width: 50%;}#sk-9fa8e572-fc23-49ec-a461-bed4406d18f9 div.sk-parallel-item:only-child::after {width: 0;}#sk-9fa8e572-fc23-49ec-a461-bed4406d18f9 div.sk-dashed-wrapped {border: 1px dashed gray;margin: 0 0.4em 0.5em 0.4em;box-sizing: border-box;padding-bottom: 0.4em;background-color: white;position: relative;}#sk-9fa8e572-fc23-49ec-a461-bed4406d18f9 div.sk-label label {font-family: monospace;font-weight: bold;background-color: white;display: inline-block;line-height: 1.2em;}#sk-9fa8e572-fc23-49ec-a461-bed4406d18f9 div.sk-label-container {position: relative;z-index: 2;text-align: center;}#sk-9fa8e572-fc23-49ec-a461-bed4406d18f9 div.sk-container {display: inline-block;position: relative;}</style><div id="sk-9fa8e572-fc23-49ec-a461-bed4406d18f9" class"sk-top-container"><div class="sk-container"><div class="sk-item sk-dashed-wrapped"><div class="sk-label-container"><div class="sk-label sk-toggleable"><input class="sk-toggleable__control sk-hidden--visually" id="9b47608e-a481-4351-a0ff-f4a5b4a3ec41" type="checkbox" ><label class="sk-toggleable__label" for="9b47608e-a481-4351-a0ff-f4a5b4a3ec41">Pipeline</label><div class="sk-toggleable__content"><pre>Pipeline(steps=[('preprocessor',
                 ColumnTransformer(transformers=[('num_cols',
                                                  Pipeline(steps=[('imputer',
                                                                   SimpleImputer(strategy='constant')),
                                                                  ('scaler',
                                                                   StandardScaler())]),
                                                  ['MSSubClass', 'LotFrontage',
                                                   'LotArea', 'OverallQual',
                                                   'OverallCond', 'YearBuilt',
                                                   'YearRemodAdd', 'MasVnrArea',
                                                   'BsmtFinSF1', 'BsmtFinSF2',
                                                   'BsmtUnfSF', 'TotalBsmtSF',
                                                   '1stFlrSF', '2ndFlrSF',
                                                   '...
                              interaction_constraints=None, learning_rate=None,
                              max_delta_step=None, max_depth=None,
                              min_child_weight=None, missing=nan,
                              monotone_constraints=None, n_estimators=100,
                              n_jobs=11, num_parallel_tree=None, predictor=None,
                              random_state=42, reg_alpha=None, reg_lambda=None,
                              scale_pos_weight=None, subsample=None,
                              tree_method=None, use_label_encoder=False,
                              validate_parameters=None, verbosity=None))])</pre></div></div></div><div class="sk-serial"><div class="sk-item sk-dashed-wrapped"><div class="sk-label-container"><div class="sk-label sk-toggleable"><input class="sk-toggleable__control sk-hidden--visually" id="d3de4fb1-75e0-4e84-87bf-e1e7dee35388" type="checkbox" ><label class="sk-toggleable__label" for="d3de4fb1-75e0-4e84-87bf-e1e7dee35388">preprocessor: ColumnTransformer</label><div class="sk-toggleable__content"><pre>ColumnTransformer(transformers=[('num_cols',
                                 Pipeline(steps=[('imputer',
                                                  SimpleImputer(strategy='constant')),
                                                 ('scaler', StandardScaler())]),
                                 ['MSSubClass', 'LotFrontage', 'LotArea',
                                  'OverallQual', 'OverallCond', 'YearBuilt',
                                  'YearRemodAdd', 'MasVnrArea', 'BsmtFinSF1',
                                  'BsmtFinSF2', 'BsmtUnfSF', 'TotalBsmtSF',
                                  '1stFlrSF', '2ndFlrSF', 'LowQualFinSF',
                                  'GrLivArea', 'BsmtF...
                                 ['MSZoning', 'Street', 'Alley', 'LotShape',
                                  'LandContour', 'Utilities', 'LotConfig',
                                  'LandSlope', 'Condition1', 'Condition2',
                                  'BldgType', 'HouseStyle', 'RoofStyle',
                                  'RoofMatl', 'MasVnrType', 'ExterQual',
                                  'ExterCond', 'Foundation', 'BsmtQual',
                                  'BsmtCond', 'BsmtExposure', 'BsmtFinType1',
                                  'BsmtFinType2', 'Heating', 'HeatingQC',
                                  'CentralAir', 'Electrical', 'KitchenQual',
                                  'Functional', 'FireplaceQu', ...])])</pre></div></div></div><div class="sk-parallel"><div class="sk-parallel-item"><div class="sk-item"><div class="sk-label-container"><div class="sk-label sk-toggleable"><input class="sk-toggleable__control sk-hidden--visually" id="08f50cb5-2f79-4b79-ac8c-8a2db42f7fbb" type="checkbox" ><label class="sk-toggleable__label" for="08f50cb5-2f79-4b79-ac8c-8a2db42f7fbb">num_cols</label><div class="sk-toggleable__content"><pre>['MSSubClass', 'LotFrontage', 'LotArea', 'OverallQual', 'OverallCond', 'YearBuilt', 'YearRemodAdd', 'MasVnrArea', 'BsmtFinSF1', 'BsmtFinSF2', 'BsmtUnfSF', 'TotalBsmtSF', '1stFlrSF', '2ndFlrSF', 'LowQualFinSF', 'GrLivArea', 'BsmtFullBath', 'BsmtHalfBath', 'FullBath', 'HalfBath', 'BedroomAbvGr', 'KitchenAbvGr', 'TotRmsAbvGrd', 'Fireplaces', 'GarageYrBlt', 'GarageCars', 'GarageArea', 'WoodDeckSF', 'OpenPorchSF', 'EnclosedPorch', '3SsnPorch', 'ScreenPorch', 'PoolArea', 'MiscVal', 'MoSold', 'YrSold']</pre></div></div></div><div class="sk-serial"><div class="sk-item"><div class="sk-serial"><div class="sk-item"><div class="sk-estimator sk-toggleable"><input class="sk-toggleable__control sk-hidden--visually" id="8409ac94-ef05-4c64-94ec-bdc12c02a60e" type="checkbox" ><label class="sk-toggleable__label" for="8409ac94-ef05-4c64-94ec-bdc12c02a60e">SimpleImputer</label><div class="sk-toggleable__content"><pre>SimpleImputer(strategy='constant')</pre></div></div></div><div class="sk-item"><div class="sk-estimator sk-toggleable"><input class="sk-toggleable__control sk-hidden--visually" id="c21ae064-839b-4b16-98af-3893cdaaf4a6" type="checkbox" ><label class="sk-toggleable__label" for="c21ae064-839b-4b16-98af-3893cdaaf4a6">StandardScaler</label><div class="sk-toggleable__content"><pre>StandardScaler()</pre></div></div></div></div></div></div></div></div><div class="sk-parallel-item"><div class="sk-item"><div class="sk-label-container"><div class="sk-label sk-toggleable"><input class="sk-toggleable__control sk-hidden--visually" id="a236afdf-86ee-41f6-ae11-29321832dffc" type="checkbox" ><label class="sk-toggleable__label" for="a236afdf-86ee-41f6-ae11-29321832dffc">cat_cols</label><div class="sk-toggleable__content"><pre>['MSZoning', 'Street', 'Alley', 'LotShape', 'LandContour', 'Utilities', 'LotConfig', 'LandSlope', 'Condition1', 'Condition2', 'BldgType', 'HouseStyle', 'RoofStyle', 'RoofMatl', 'MasVnrType', 'ExterQual', 'ExterCond', 'Foundation', 'BsmtQual', 'BsmtCond', 'BsmtExposure', 'BsmtFinType1', 'BsmtFinType2', 'Heating', 'HeatingQC', 'CentralAir', 'Electrical', 'KitchenQual', 'Functional', 'FireplaceQu', 'GarageType', 'GarageFinish', 'GarageQual', 'GarageCond', 'PavedDrive', 'PoolQC', 'Fence', 'MiscFeature', 'SaleType', 'SaleCondition', 'Neighborhood', 'Exterior1st', 'Exterior2nd']</pre></div></div></div><div class="sk-serial"><div class="sk-item"><div class="sk-serial"><div class="sk-item"><div class="sk-estimator sk-toggleable"><input class="sk-toggleable__control sk-hidden--visually" id="9678d35d-28f7-4def-95f0-de5c8886f164" type="checkbox" ><label class="sk-toggleable__label" for="9678d35d-28f7-4def-95f0-de5c8886f164">SimpleImputer</label><div class="sk-toggleable__content"><pre>SimpleImputer(strategy='constant')</pre></div></div></div><div class="sk-item"><div class="sk-estimator sk-toggleable"><input class="sk-toggleable__control sk-hidden--visually" id="035300a4-0bb7-4c10-bfe8-83b6437dbafd" type="checkbox" ><label class="sk-toggleable__label" for="035300a4-0bb7-4c10-bfe8-83b6437dbafd">OneHotEncoder</label><div class="sk-toggleable__content"><pre>OneHotEncoder(handle_unknown='ignore')</pre></div></div></div></div></div></div></div></div></div></div><div class="sk-item"><div class="sk-estimator sk-toggleable"><input class="sk-toggleable__control sk-hidden--visually" id="a16d44b4-053d-4443-aea3-d6869cec4d52" type="checkbox" ><label class="sk-toggleable__label" for="a16d44b4-053d-4443-aea3-d6869cec4d52">XGBRegressor</label><div class="sk-toggleable__content"><pre>XGBRegressor(base_score=None, booster=None, colsample_bylevel=None,
             colsample_bynode=None, colsample_bytree=None,
             enable_categorical=False, eval_metric='mae', gamma=None,
             gpu_id=None, importance_type=None, interaction_constraints=None,
             learning_rate=None, max_delta_step=None, max_depth=None,
             min_child_weight=None, missing=nan, monotone_constraints=None,
             n_estimators=100, n_jobs=11, num_parallel_tree=None,
             predictor=None, random_state=42, reg_alpha=None, reg_lambda=None,
             scale_pos_weight=None, subsample=None, tree_method=None,
             use_label_encoder=False, validate_parameters=None, verbosity=None)</pre></div></div></div></div></div></div></div>



```
# create train, valid split to evaulate model on valid dataset
tmlt.dfl.create_train_valid(valid_size=0.2)

start = time.time()
# Now fit
tmlt.spl.fit(tmlt.dfl.X_train, tmlt.dfl.y_train)
end = time.time()
print("Fit Time:", end - start)

#predict
preds = tmlt.spl.predict(tmlt.dfl.X_valid)
print('X_valid MAE:', mean_absolute_error(tmlt.dfl.y_valid, preds))
```

    Fit Time: 0.232680082321167
    X_valid MAE: 16565.101415346748


In background `prepare_data_for_training` method loads your input data into Pandas DataFrame, seprates X(features) and y(target).

The `prepare_data_for_training` methods prepare X and y DataFrames, preprocess all numerical and categorical type data found in these DataFrames using scikit-learn pipelines. Then it bundle preprocessed data with your given model and return an MLPipeline object, this class instance has dataframeloader, preprocessor and scikit-lean pipeline instances.

The `create_train_valid` method use valid_size to split X(features) into X_train, y_train, X_valid and y_valid DataFrames, so you can call fit methods on X_train and y_train and predict methods on X_valid or X_test.


Please check detail documentation and source code for more details.

*NOTE: If you want to customize data and preprocessing steps you can do so by using `DataFrameLoader` and `PreProessor` classes. Check detail documentations for these classes for more options.*



#### To see more clear picture of model performance, Let's do a quick Cross Validation on our Pipeline

```
start = time.time()
# Now do cross_validation
scores = tmlt.do_cross_validation(cv=5, scoring='neg_mean_absolute_error')
end = time.time()
print("Cross Validation Time:", end - start)

print("scores:", scores)
print("Average MAE score:", scores.mean())
```

    Cross Validation Time: 1.1889641284942627
    scores: [15865.5140732  18431.08924176 18670.3333155  15439.67369435
     16835.6969847 ]
    Average MAE score: 17048.461461900682


##### *MAE did came out slightly bad with cross validation*

##### Let's see if we can improve our cross validation score with hyperparams tunning

```
# lets choose our choice of metrics
from sklearn.metrics import mean_absolute_error, mean_squared_error, r2_score, mean_squared_log_error
```

**we are using optuna based hyperparameter search here, make sure to supply a new directory path so search is saved**

```
study = tmlt.do_xgb_optuna_optimization(preds_metrics=[mean_absolute_error,
                                                       mean_squared_error,
                                                       r2_score],
                                        output_dir_path=OUTPUT_PATH)
print(study.best_trial)
```

    2021-11-22 16:58:20,148 INFO Optimization Direction is: minimize
    [32m[I 2021-11-22 16:58:20,175][0m Using an existing study with name 'tmlt_autoxgb' instead of creating a new one.[0m
    2021-11-22 16:58:20,296 INFO Training Started!


    [16:58:20] WARNING: /Users/runner/miniforge3/conda-bld/xgboost-split_1634712680264/work/src/learner.cc:576: 
    Parameters: { "colsample_bytree", "max_depth", "subsample", "tree_method" } might not be used.
    
      This could be a false alarm, with some parameters getting used by language bindings but
      then being mistakenly passed down to XGBoost core, or some parameter actually being used
      but getting flagged wrongly here. Please open an issue if you find any such cases.
    
    


    2021-11-22 16:58:26,066 INFO Training Ended!
    2021-11-22 16:58:26,116 INFO mean_absolute_error: 18430.128959760274
    2021-11-22 16:58:26,116 INFO mean_squared_error: 1003740151.2011865
    2021-11-22 16:58:26,117 INFO r2_score: 0.8691398352444675
    [32m[I 2021-11-22 16:58:26,148][0m Trial 5 finished with value: 1003740151.2011865 and parameters: {'learning_rate': 0.011287646791421295, 'reg_lambda': 0.06938986879711422, 'reg_alpha': 8.176124256580969e-05, 'subsample': 0.3654130556583419, 'colsample_bytree': 0.3647997317624503, 'max_depth': 1, 'early_stopping_rounds': 240, 'n_estimators': 20000, 'tree_method': 'approx', 'booster': 'gblinear'}. Best is trial 2 with value: 859935950.534274.[0m
    2021-11-22 16:58:26,247 INFO Training Started!


    [16:58:26] WARNING: /Users/runner/miniforge3/conda-bld/xgboost-split_1634712680264/work/src/learner.cc:576: 
    Parameters: { "colsample_bytree", "max_depth", "subsample", "tree_method" } might not be used.
    
      This could be a false alarm, with some parameters getting used by language bindings but
      then being mistakenly passed down to XGBoost core, or some parameter actually being used
      but getting flagged wrongly here. Please open an issue if you find any such cases.
    
    


    2021-11-22 16:58:28,378 INFO Training Ended!
    2021-11-22 16:58:28,424 INFO mean_absolute_error: 31222.505752354453
    2021-11-22 16:58:28,424 INFO mean_squared_error: 2771208996.3631716
    2021-11-22 16:58:28,425 INFO r2_score: 0.638710411850993
    [32m[I 2021-11-22 16:58:28,449][0m Trial 6 finished with value: 2771208996.3631716 and parameters: {'learning_rate': 0.03334511464699647, 'reg_lambda': 5.25800680500751, 'reg_alpha': 0.045533012584301466, 'subsample': 0.5010774952608195, 'colsample_bytree': 0.5190423499031988, 'max_depth': 5, 'early_stopping_rounds': 122, 'n_estimators': 7000, 'tree_method': 'hist', 'booster': 'gblinear'}. Best is trial 2 with value: 859935950.534274.[0m
    2021-11-22 16:58:28,542 INFO Training Started!


    [16:58:28] WARNING: /Users/runner/miniforge3/conda-bld/xgboost-split_1634712680264/work/src/learner.cc:576: 
    Parameters: { "colsample_bytree", "max_depth", "subsample", "tree_method" } might not be used.
    
      This could be a false alarm, with some parameters getting used by language bindings but
      then being mistakenly passed down to XGBoost core, or some parameter actually being used
      but getting flagged wrongly here. Please open an issue if you find any such cases.
    
    


    2021-11-22 16:58:34,604 INFO Training Ended!
    2021-11-22 16:58:34,657 INFO mean_absolute_error: 18308.20339255137
    2021-11-22 16:58:34,657 INFO mean_squared_error: 819804093.191586
    2021-11-22 16:58:34,658 INFO r2_score: 0.8931200484767615
