    [32m[I 2021-11-22 17:04:40,608][0m Trial 19 finished with value: 716682978.005267 and parameters: {'learning_rate': 0.0578712823399666, 'reg_lambda': 1.1030332244677372e-06, 'reg_alpha': 4.487986572959091e-06, 'subsample': 0.8699561697539606, 'colsample_bytree': 0.6341900847864899, 'max_depth': 6, 'early_stopping_rounds': 419, 'n_estimators': 15000, 'tree_method': 'approx', 'booster': 'gbtree', 'gamma': 0.005851046483654154, 'grow_policy': 'lossguide'}. Best is trial 16 with value: 686933953.1421537.[0m


    FrozenTrial(number=16, values=[686933953.1421537], datetime_start=datetime.datetime(2021, 11, 22, 17, 2, 48, 252811), datetime_complete=datetime.datetime(2021, 11, 22, 17, 3, 36, 141725), params={'booster': 'gbtree', 'colsample_bytree': 0.9947016819536298, 'early_stopping_rounds': 409, 'gamma': 0.0038226799902060316, 'grow_policy': 'lossguide', 'learning_rate': 0.08235476908327058, 'max_depth': 7, 'n_estimators': 15000, 'reg_alpha': 1.0067601266720434e-08, 'reg_lambda': 6.647799361804065e-07, 'subsample': 0.7228884546525054, 'tree_method': 'approx'}, distributions={'booster': CategoricalDistribution(choices=('gbtree', 'gblinear')), 'colsample_bytree': UniformDistribution(high=1.0, low=0.1), 'early_stopping_rounds': IntUniformDistribution(high=500, low=100, step=1), 'gamma': LogUniformDistribution(high=1.0, low=1e-08), 'grow_policy': CategoricalDistribution(choices=('depthwise', 'lossguide')), 'learning_rate': LogUniformDistribution(high=0.25, low=0.01), 'max_depth': IntUniformDistribution(high=9, low=1, step=1), 'n_estimators': CategoricalDistribution(choices=(7000, 15000, 20000)), 'reg_alpha': LogUniformDistribution(high=100.0, low=1e-08), 'reg_lambda': LogUniformDistribution(high=100.0, low=1e-08), 'subsample': UniformDistribution(high=1.0, low=0.1), 'tree_method': CategoricalDistribution(choices=('exact', 'approx', 'hist'))}, user_attrs={}, system_attrs={}, intermediate_values={}, trial_id=17, state=TrialState.COMPLETE, value=None)


#### Let's use our newly found best params to update the model on sklearn pipeline

```
xgb_params.update(study.best_trial.params)
print("xgb_params", xgb_params)
xgb_model = XGBRegressor(**xgb_params)
tmlt.update_model(xgb_model)
tmlt.spl
```

    xgb_params {'use_label_encoder': False, 'eval_metric': 'mae', 'random_state': 42, 'booster': 'gbtree', 'colsample_bytree': 0.9947016819536298, 'early_stopping_rounds': 409, 'gamma': 0.0038226799902060316, 'grow_policy': 'lossguide', 'learning_rate': 0.08235476908327058, 'max_depth': 7, 'n_estimators': 15000, 'reg_alpha': 1.0067601266720434e-08, 'reg_lambda': 6.647799361804065e-07, 'subsample': 0.7228884546525054, 'tree_method': 'approx'}





<style>#sk-2e31a1db-0287-4ccc-86d3-47f28ee2ee9a {color: black;background-color: white;}#sk-2e31a1db-0287-4ccc-86d3-47f28ee2ee9a pre{padding: 0;}#sk-2e31a1db-0287-4ccc-86d3-47f28ee2ee9a div.sk-toggleable {background-color: white;}#sk-2e31a1db-0287-4ccc-86d3-47f28ee2ee9a label.sk-toggleable__label {cursor: pointer;display: block;width: 100%;margin-bottom: 0;padding: 0.3em;box-sizing: border-box;text-align: center;}#sk-2e31a1db-0287-4ccc-86d3-47f28ee2ee9a div.sk-toggleable__content {max-height: 0;max-width: 0;overflow: hidden;text-align: left;background-color: #f0f8ff;}#sk-2e31a1db-0287-4ccc-86d3-47f28ee2ee9a div.sk-toggleable__content pre {margin: 0.2em;color: black;border-radius: 0.25em;background-color: #f0f8ff;}#sk-2e31a1db-0287-4ccc-86d3-47f28ee2ee9a input.sk-toggleable__control:checked~div.sk-toggleable__content {max-height: 200px;max-width: 100%;overflow: auto;}#sk-2e31a1db-0287-4ccc-86d3-47f28ee2ee9a div.sk-estimator input.sk-toggleable__control:checked~label.sk-toggleable__label {background-color: #d4ebff;}#sk-2e31a1db-0287-4ccc-86d3-47f28ee2ee9a div.sk-label input.sk-toggleable__control:checked~label.sk-toggleable__label {background-color: #d4ebff;}#sk-2e31a1db-0287-4ccc-86d3-47f28ee2ee9a input.sk-hidden--visually {border: 0;clip: rect(1px 1px 1px 1px);clip: rect(1px, 1px, 1px, 1px);height: 1px;margin: -1px;overflow: hidden;padding: 0;position: absolute;width: 1px;}#sk-2e31a1db-0287-4ccc-86d3-47f28ee2ee9a div.sk-estimator {font-family: monospace;background-color: #f0f8ff;border: 1px dotted black;border-radius: 0.25em;box-sizing: border-box;margin-bottom: 0.5em;}#sk-2e31a1db-0287-4ccc-86d3-47f28ee2ee9a div.sk-estimator:hover {background-color: #d4ebff;}#sk-2e31a1db-0287-4ccc-86d3-47f28ee2ee9a div.sk-parallel-item::after {content: "";width: 100%;border-bottom: 1px solid gray;flex-grow: 1;}#sk-2e31a1db-0287-4ccc-86d3-47f28ee2ee9a div.sk-label:hover label.sk-toggleable__label {background-color: #d4ebff;}#sk-2e31a1db-0287-4ccc-86d3-47f28ee2ee9a div.sk-serial::before {content: "";position: absolute;border-left: 1px solid gray;box-sizing: border-box;top: 2em;bottom: 0;left: 50%;}#sk-2e31a1db-0287-4ccc-86d3-47f28ee2ee9a div.sk-serial {display: flex;flex-direction: column;align-items: center;background-color: white;padding-right: 0.2em;padding-left: 0.2em;}#sk-2e31a1db-0287-4ccc-86d3-47f28ee2ee9a div.sk-item {z-index: 1;}#sk-2e31a1db-0287-4ccc-86d3-47f28ee2ee9a div.sk-parallel {display: flex;align-items: stretch;justify-content: center;background-color: white;}#sk-2e31a1db-0287-4ccc-86d3-47f28ee2ee9a div.sk-parallel::before {content: "";position: absolute;border-left: 1px solid gray;box-sizing: border-box;top: 2em;bottom: 0;left: 50%;}#sk-2e31a1db-0287-4ccc-86d3-47f28ee2ee9a div.sk-parallel-item {display: flex;flex-direction: column;position: relative;background-color: white;}#sk-2e31a1db-0287-4ccc-86d3-47f28ee2ee9a div.sk-parallel-item:first-child::after {align-self: flex-end;width: 50%;}#sk-2e31a1db-0287-4ccc-86d3-47f28ee2ee9a div.sk-parallel-item:last-child::after {align-self: flex-start;width: 50%;}#sk-2e31a1db-0287-4ccc-86d3-47f28ee2ee9a div.sk-parallel-item:only-child::after {width: 0;}#sk-2e31a1db-0287-4ccc-86d3-47f28ee2ee9a div.sk-dashed-wrapped {border: 1px dashed gray;margin: 0 0.4em 0.5em 0.4em;box-sizing: border-box;padding-bottom: 0.4em;background-color: white;position: relative;}#sk-2e31a1db-0287-4ccc-86d3-47f28ee2ee9a div.sk-label label {font-family: monospace;font-weight: bold;background-color: white;display: inline-block;line-height: 1.2em;}#sk-2e31a1db-0287-4ccc-86d3-47f28ee2ee9a div.sk-label-container {position: relative;z-index: 2;text-align: center;}#sk-2e31a1db-0287-4ccc-86d3-47f28ee2ee9a div.sk-container {display: inline-block;position: relative;}</style><div id="sk-2e31a1db-0287-4ccc-86d3-47f28ee2ee9a" class"sk-top-container"><div class="sk-container"><div class="sk-item sk-dashed-wrapped"><div class="sk-label-container"><div class="sk-label sk-toggleable"><input class="sk-toggleable__control sk-hidden--visually" id="eaec5118-a728-46f6-b3e5-3f57f23b67a9" type="checkbox" ><label class="sk-toggleable__label" for="eaec5118-a728-46f6-b3e5-3f57f23b67a9">Pipeline</label><div class="sk-toggleable__content"><pre>Pipeline(steps=[('preprocessor',
                 ColumnTransformer(transformers=[('num_cols',
                                                  Pipeline(steps=[('imputer',
                                                                   SimpleImputer(strategy='constant')),
                                                                  ('scaler',
                                                                   StandardScaler())]),
                                                  ['MSSubClass', 'LotFrontage',
                                                   'LotArea', 'OverallQual',
                                                   'OverallCond', 'YearBuilt',
                                                   'YearRemodAdd', 'MasVnrArea',
                                                   'BsmtFinSF1', 'BsmtFinSF2',
                                                   'BsmtUnfSF', 'TotalBsmtSF',
                                                   '1stFlrSF', '2ndFlrSF',
                                                   '...
                              learning_rate=0.08235476908327058,
                              max_delta_step=None, max_depth=7,
                              min_child_weight=None, missing=nan,
                              monotone_constraints=None, n_estimators=15000,
                              n_jobs=None, num_parallel_tree=None,
                              predictor=None, random_state=42,
                              reg_alpha=1.0067601266720434e-08,
                              reg_lambda=6.647799361804065e-07,
                              scale_pos_weight=None,
                              subsample=0.7228884546525054,
                              tree_method='approx', use_label_encoder=False, ...))])</pre></div></div></div><div class="sk-serial"><div class="sk-item sk-dashed-wrapped"><div class="sk-label-container"><div class="sk-label sk-toggleable"><input class="sk-toggleable__control sk-hidden--visually" id="0c96efa7-77dd-4ed9-b87f-c46dc5ec64ee" type="checkbox" ><label class="sk-toggleable__label" for="0c96efa7-77dd-4ed9-b87f-c46dc5ec64ee">preprocessor: ColumnTransformer</label><div class="sk-toggleable__content"><pre>ColumnTransformer(transformers=[('num_cols',
                                 Pipeline(steps=[('imputer',
                                                  SimpleImputer(strategy='constant')),
                                                 ('scaler', StandardScaler())]),
                                 ['MSSubClass', 'LotFrontage', 'LotArea',
                                  'OverallQual', 'OverallCond', 'YearBuilt',
                                  'YearRemodAdd', 'MasVnrArea', 'BsmtFinSF1',
                                  'BsmtFinSF2', 'BsmtUnfSF', 'TotalBsmtSF',
                                  '1stFlrSF', '2ndFlrSF', 'LowQualFinSF',
                                  'GrLivArea', 'BsmtF...
                                 ['MSZoning', 'Street', 'Alley', 'LotShape',
                                  'LandContour', 'Utilities', 'LotConfig',
                                  'LandSlope', 'Condition1', 'Condition2',
                                  'BldgType', 'HouseStyle', 'RoofStyle',
                                  'RoofMatl', 'MasVnrType', 'ExterQual',
                                  'ExterCond', 'Foundation', 'BsmtQual',
                                  'BsmtCond', 'BsmtExposure', 'BsmtFinType1',
                                  'BsmtFinType2', 'Heating', 'HeatingQC',
                                  'CentralAir', 'Electrical', 'KitchenQual',
                                  'Functional', 'FireplaceQu', ...])])</pre></div></div></div><div class="sk-parallel"><div class="sk-parallel-item"><div class="sk-item"><div class="sk-label-container"><div class="sk-label sk-toggleable"><input class="sk-toggleable__control sk-hidden--visually" id="a236f6ea-f75b-4ac9-8a89-322e2e8089fa" type="checkbox" ><label class="sk-toggleable__label" for="a236f6ea-f75b-4ac9-8a89-322e2e8089fa">num_cols</label><div class="sk-toggleable__content"><pre>['MSSubClass', 'LotFrontage', 'LotArea', 'OverallQual', 'OverallCond', 'YearBuilt', 'YearRemodAdd', 'MasVnrArea', 'BsmtFinSF1', 'BsmtFinSF2', 'BsmtUnfSF', 'TotalBsmtSF', '1stFlrSF', '2ndFlrSF', 'LowQualFinSF', 'GrLivArea', 'BsmtFullBath', 'BsmtHalfBath', 'FullBath', 'HalfBath', 'BedroomAbvGr', 'KitchenAbvGr', 'TotRmsAbvGrd', 'Fireplaces', 'GarageYrBlt', 'GarageCars', 'GarageArea', 'WoodDeckSF', 'OpenPorchSF', 'EnclosedPorch', '3SsnPorch', 'ScreenPorch', 'PoolArea', 'MiscVal', 'MoSold', 'YrSold']</pre></div></div></div><div class="sk-serial"><div class="sk-item"><div class="sk-serial"><div class="sk-item"><div class="sk-estimator sk-toggleable"><input class="sk-toggleable__control sk-hidden--visually" id="02562a0c-2fbf-46a9-a451-c0b32d0dadea" type="checkbox" ><label class="sk-toggleable__label" for="02562a0c-2fbf-46a9-a451-c0b32d0dadea">SimpleImputer</label><div class="sk-toggleable__content"><pre>SimpleImputer(strategy='constant')</pre></div></div></div><div class="sk-item"><div class="sk-estimator sk-toggleable"><input class="sk-toggleable__control sk-hidden--visually" id="80b365be-3573-4be7-9375-42eaab4e66ab" type="checkbox" ><label class="sk-toggleable__label" for="80b365be-3573-4be7-9375-42eaab4e66ab">StandardScaler</label><div class="sk-toggleable__content"><pre>StandardScaler()</pre></div></div></div></div></div></div></div></div><div class="sk-parallel-item"><div class="sk-item"><div class="sk-label-container"><div class="sk-label sk-toggleable"><input class="sk-toggleable__control sk-hidden--visually" id="caea1be7-b864-4a91-b796-607b663c9e49" type="checkbox" ><label class="sk-toggleable__label" for="caea1be7-b864-4a91-b796-607b663c9e49">cat_cols</label><div class="sk-toggleable__content"><pre>['MSZoning', 'Street', 'Alley', 'LotShape', 'LandContour', 'Utilities', 'LotConfig', 'LandSlope', 'Condition1', 'Condition2', 'BldgType', 'HouseStyle', 'RoofStyle', 'RoofMatl', 'MasVnrType', 'ExterQual', 'ExterCond', 'Foundation', 'BsmtQual', 'BsmtCond', 'BsmtExposure', 'BsmtFinType1', 'BsmtFinType2', 'Heating', 'HeatingQC', 'CentralAir', 'Electrical', 'KitchenQual', 'Functional', 'FireplaceQu', 'GarageType', 'GarageFinish', 'GarageQual', 'GarageCond', 'PavedDrive', 'PoolQC', 'Fence', 'MiscFeature', 'SaleType', 'SaleCondition', 'Neighborhood', 'Exterior1st', 'Exterior2nd']</pre></div></div></div><div class="sk-serial"><div class="sk-item"><div class="sk-serial"><div class="sk-item"><div class="sk-estimator sk-toggleable"><input class="sk-toggleable__control sk-hidden--visually" id="a08af16a-85b9-4e86-89d7-8b5c4c96d948" type="checkbox" ><label class="sk-toggleable__label" for="a08af16a-85b9-4e86-89d7-8b5c4c96d948">SimpleImputer</label><div class="sk-toggleable__content"><pre>SimpleImputer(strategy='constant')</pre></div></div></div><div class="sk-item"><div class="sk-estimator sk-toggleable"><input class="sk-toggleable__control sk-hidden--visually" id="6c519629-2d6c-4b15-b612-5e18d611fbf6" type="checkbox" ><label class="sk-toggleable__label" for="6c519629-2d6c-4b15-b612-5e18d611fbf6">OneHotEncoder</label><div class="sk-toggleable__content"><pre>OneHotEncoder(handle_unknown='ignore')</pre></div></div></div></div></div></div></div></div></div></div><div class="sk-item"><div class="sk-estimator sk-toggleable"><input class="sk-toggleable__control sk-hidden--visually" id="098bbbcd-22b3-409d-940e-b0e16376c24c" type="checkbox" ><label class="sk-toggleable__label" for="098bbbcd-22b3-409d-940e-b0e16376c24c">XGBRegressor</label><div class="sk-toggleable__content"><pre>XGBRegressor(base_score=None, booster='gbtree', colsample_bylevel=None,
             colsample_bynode=None, colsample_bytree=0.9947016819536298,
             early_stopping_rounds=409, enable_categorical=False,
             eval_metric='mae', gamma=0.0038226799902060316, gpu_id=None,
             grow_policy='lossguide', importance_type=None,
             interaction_constraints=None, learning_rate=0.08235476908327058,
             max_delta_step=None, max_depth=7, min_child_weight=None,
             missing=nan, monotone_constraints=None, n_estimators=15000,
             n_jobs=None, num_parallel_tree=None, predictor=None,
             random_state=42, reg_alpha=1.0067601266720434e-08,
             reg_lambda=6.647799361804065e-07, scale_pos_weight=None,
             subsample=0.7228884546525054, tree_method='approx',
             use_label_encoder=False, ...)</pre></div></div></div></div></div></div></div>



#### Now, Let's use 5 K-Fold Training on this Updated XGB model with best params found from Optuna search

```
# k-fold training
xgb_model_metrics_score, xgb_model_test_preds = tmlt.do_kfold_training(n_splits=5, metrics=mean_absolute_error)
```

    /Users/pamathur/miniconda3/envs/nbdev_env/lib/python3.9/site-packages/sklearn/model_selection/_split.py:676: UserWarning: The least populated class in y has only 1 members, which is less than n_splits=10.
      warnings.warn(


    [17:05:00] WARNING: /Users/runner/miniforge3/conda-bld/xgboost-split_1634712680264/work/src/learner.cc:576: 
    Parameters: { "early_stopping_rounds" } might not be used.
    
      This could be a false alarm, with some parameters getting used by language bindings but
      then being mistakenly passed down to XGBoost core, or some parameter actually being used
      but getting flagged wrongly here. Please open an issue if you find any such cases.
    
    


    2021-11-22 17:05:47,618 INFO fold: 1 , mean_absolute_error: 15661.41831656678


    [17:05:47] WARNING: /Users/runner/miniforge3/conda-bld/xgboost-split_1634712680264/work/src/learner.cc:576: 
    Parameters: { "early_stopping_rounds" } might not be used.
    
      This could be a false alarm, with some parameters getting used by language bindings but
      then being mistakenly passed down to XGBoost core, or some parameter actually being used
      but getting flagged wrongly here. Please open an issue if you find any such cases.
    
    


    2021-11-22 17:06:59,831 INFO fold: 2 , mean_absolute_error: 16383.731324914384


    [17:06:59] WARNING: /Users/runner/miniforge3/conda-bld/xgboost-split_1634712680264/work/src/learner.cc:576: 
    Parameters: { "early_stopping_rounds" } might not be used.
    
      This could be a false alarm, with some parameters getting used by language bindings but
      then being mistakenly passed down to XGBoost core, or some parameter actually being used
      but getting flagged wrongly here. Please open an issue if you find any such cases.
    
    


    2021-11-22 17:07:50,938 INFO fold: 3 , mean_absolute_error: 15294.39223030822


    [17:07:50] WARNING: /Users/runner/miniforge3/conda-bld/xgboost-split_1634712680264/work/src/learner.cc:576: 
    Parameters: { "early_stopping_rounds" } might not be used.
    
      This could be a false alarm, with some parameters getting used by language bindings but
      then being mistakenly passed down to XGBoost core, or some parameter actually being used
      but getting flagged wrongly here. Please open an issue if you find any such cases.
    
    


    2021-11-22 17:08:47,789 INFO fold: 4 , mean_absolute_error: 14800.260916095891


    [17:08:47] WARNING: /Users/runner/miniforge3/conda-bld/xgboost-split_1634712680264/work/src/learner.cc:576: 
    Parameters: { "early_stopping_rounds" } might not be used.
    
      This could be a false alarm, with some parameters getting used by language bindings but
      then being mistakenly passed down to XGBoost core, or some parameter actually being used
      but getting flagged wrongly here. Please open an issue if you find any such cases.
    
    


    2021-11-22 17:09:37,629 INFO fold: 5 , mean_absolute_error: 14129.463800299658


    [17:09:37] WARNING: /Users/runner/miniforge3/conda-bld/xgboost-split_1634712680264/work/src/learner.cc:576: 
    Parameters: { "early_stopping_rounds" } might not be used.
    
      This could be a false alarm, with some parameters getting used by language bindings but
      then being mistakenly passed down to XGBoost core, or some parameter actually being used
      but getting flagged wrongly here. Please open an issue if you find any such cases.
    
    


    2021-11-22 17:10:28,624 INFO fold: 6 , mean_absolute_error: 19015.87021083048


    [17:10:28] WARNING: /Users/runner/miniforge3/conda-bld/xgboost-split_1634712680264/work/src/learner.cc:576: 
    Parameters: { "early_stopping_rounds" } might not be used.
    
      This could be a false alarm, with some parameters getting used by language bindings but
      then being mistakenly passed down to XGBoost core, or some parameter actually being used
      but getting flagged wrongly here. Please open an issue if you find any such cases.
    
    


    2021-11-22 17:11:37,261 INFO fold: 7 , mean_absolute_error: 14327.51765839041


    [17:11:37] WARNING: /Users/runner/miniforge3/conda-bld/xgboost-split_1634712680264/work/src/learner.cc:576: 
    Parameters: { "early_stopping_rounds" } might not be used.
    
      This could be a false alarm, with some parameters getting used by language bindings but
      then being mistakenly passed down to XGBoost core, or some parameter actually being used
      but getting flagged wrongly here. Please open an issue if you find any such cases.
    
    


    2021-11-22 17:12:48,462 INFO fold: 8 , mean_absolute_error: 17722.195740582192


    [17:12:48] WARNING: /Users/runner/miniforge3/conda-bld/xgboost-split_1634712680264/work/src/learner.cc:576: 
    Parameters: { "early_stopping_rounds" } might not be used.
    
      This could be a false alarm, with some parameters getting used by language bindings but
      then being mistakenly passed down to XGBoost core, or some parameter actually being used
      but getting flagged wrongly here. Please open an issue if you find any such cases.
    
    


    2021-11-22 17:13:39,624 INFO fold: 9 , mean_absolute_error: 15262.005136986301


    [17:13:39] WARNING: /Users/runner/miniforge3/conda-bld/xgboost-split_1634712680264/work/src/learner.cc:576: 
    Parameters: { "early_stopping_rounds" } might not be used.
    
      This could be a false alarm, with some parameters getting used by language bindings but
      then being mistakenly passed down to XGBoost core, or some parameter actually being used
      but getting flagged wrongly here. Please open an issue if you find any such cases.
    
    


    2021-11-22 17:14:30,893 INFO fold: 10 , mean_absolute_error: 15830.971532534246
    2021-11-22 17:14:30,894 INFO  mean metrics score: 15842.782686750856



    ---------------------------------------------------------------------------

    ValueError                                Traceback (most recent call last)

    /var/folders/p3/zmg8jfwx0hb9gwzs0w69d7f0rgyjx2/T/ipykernel_70698/3966110186.py in <module>
          2 xgb_model_metrics_score, xgb_model_test_preds = tmlt.do_kfold_training(n_splits=10, metrics=mean_absolute_error)
          3 # predict on test dataset
    ----> 4 if xgb_model_test_preds:
          5     print(xgb_m